Id,Long Name (en),Long Name (fr),Short Name (fr),Short Name (en),Candidate Suffix,Custom Name
BC,Bloc Québécois,Bloc Québécois,Bloc Québécois,Bloc Québécois, Bloc Québécois/Bloc Québécois,Bloc Québécois
CPC,Conservative Party of Canada,Parti conservateur du Canada,Conservateur,Conservative, Conservative/Conservateur,Conservative
GRN,Green Party of Canada,Le Parti Vert du Canada,Parti Vert,Green Party, Green Party/Parti Vert,Green Party
LIB,Liberal Party of Canada,Parti libéral du Canada,Libéral,Liberal, Liberal/Libéral,Liberal
NDP,New Democratic Party,Nouveau Parti démocratique,NPD-Nouveau Parti démocratique,NDP-New Democratic Party, NDP-New Democratic Party/NPD-Nouveau Parti démocratique,NDP
